Column,Date,User,Tweet,Tweet Bersih,Sentiment
10262,2022-08-24 00:57:35+00:00,kalla_jengking,"Menkes : Jangan Lupa Prokes dan Lakukan Vaksinasi Booster

Menkes mengimbau para pengunjung Jakarta Fair untuk tetap disiplin prokes dan menghindari kerumunan serta menyegerakan vaksinasi dosis lengkap maupun booster Covid-19.

#TetapProkesLengkapiVaksin
#IndonesiaSemakinHebat https://t.co/xdsMhSdtbh",menkes lupa prokes laku vaksinasi booster menkes imbau unjung jakarta fair disiplin prokes hindar kerumun segera vaksinasi dosis lengkap booster covid tetapprokeslengkapivaksin indonesiasemakinhebat,2
6840,2022-08-02 00:00:01+00:00,isanaya12,Ayo vaksin agar Tanah Papua terbebas dari belenggu Covid-19 varian baru yang dinamakan Omicron BA.4 dan BA.5. Sukseskan vaksinasi! #PapuaSejahteraBerkatDOB #PapuaIndonesia https://t.co/msFvWkl2jd,ayo vaksin tanah papua bebas belenggu covid varian nama omicron ba ba sukses vaksinasi papuasejahteraberkatdob papuaindonesia,2
9308,2022-08-29 08:12:35+00:00,JayaKatwang15,Percepatan pemberian vaksinasi booster kedua atau dosis keempat bagi seluruh masyarakat Indonesia harus benar-benar didukung karena dengan hal tersebut akan mampu melindungi seluruh masyarakat dari bahaya ancaman Covid-19. https://t.co/3ccyYkulT3,cepat beri vaksinasi booster dosis empat masyarakat indonesia dukung lindung masyarakat bahaya ancam covid,2
8074,2022-08-16 08:46:35+00:00,PemkabPringsewu,"2. Presiden @jokowi menuturkan bahwa meskipun dengan adanya Pandemi Covid-19, Indonesia berhasil menjadi salah satu negara yang dapat mengendalikan pandemi. Salah satunya dengan menyelenggarakan vaksinasi terbesar di dunia dan juga menekan angka inflasi sampai di kisaran 4,9%. https://t.co/sHYIm7zhUw",presiden pandemi covid indonesia hasil salah negara kendali pandemi salah satu selenggara vaksinasi besar dunia tekan angka inflasi kisar,1
6718,2022-08-02 04:09:20+00:00,PolsekTeluknag4,Antusias warga saat Pelayanan vaksinasi booster Polsek Teluknaga buka setiap hari kerja untuk Dosis 1 2 dan booster guna meningkatkan imunitas tubuh melawan Covid 19 https://t.co/uXSoafStmH,antusias warga layan vaksinasi booster polsek teluknaga buka kerja dosis booster tingkat imunitas tubuh lawan covid,1
7505,2022-08-19 05:01:27+00:00,jamurgorenk,"Pandemi covid sudah mulai kembali pulih, aktifitas masyarakat sudah mulai perlahan seimbang kembali. Tingkat vaksinasi covid-19 yang semakin tinggi. 
#ApaGunaDigital
#OnlineUntukApa
Cara Hidup Digital https://t.co/buOlwJc75q",pandemi covid pulih aktifitas masyarakat perlahan imbang tingkat vaksinasi covid apagunadigital onlineuntukapa hidup digital,1
12,2022-08-10 07:23:43+00:00,_jungss,"RT @_JEL00: Sungtaro &amp; Jaewoo one tweet Au.

— PPKM menurut keluarga Jung

Cw: dirty talk, hashword, 18+. https://t.co/a9XWf5cRBh",sungtaro jaewoo one tweet au  ppkm keluarga jung cw dirty talk hashword,1
5280,2022-08-09 10:56:54+00:00,Humas_DinkesPB,"Update data pelaksanaan vaksinasi covid-19 Bagi Tenaga Kesehatan, Palayan Publik dan Lansia di Provinsi Papua Barat, Pertanggal 04 Agustus 2022.

https://t.co/F1oXymUe4a

#humasdinkespabar
#vaksinasipabar
#vaksinasinasional
#kemenkes_ri
#papuabaratnkri https://t.co/cVVfUcFCOi",update data laksana vaksinasi covid tenaga sehat palayan publik lansia provinsi papua barat tanggal agustus humasdinkespabar vaksinasipabar vaksinasinasional kemenkes ri papuabaratnkri,1
5976,2022-08-05 12:21:02+00:00,gowestid,Wali Kota Tanjungpinang Apresiasi Program Vaksinasi Covid-19 dari Binda Kepri https://t.co/2UroKslvCV,wali kota tanjungpinang apresiasi program vaksinasi covid binda kepri,1
4598,2022-08-24 05:40:59+00:00,faizallukman83,"Percepatan program vaksinasi nasional berhasil menurunkan kasus covid-19 👍👍👍
#EndemiCovid
#IndonesiaSehatIndonesiaHebat
#BeritaCovid
#PPKM https://t.co/QMKYb9o7l9",cepat program vaksinasi nasional hasil turun covid  endemicovid indonesiasehatindonesiahebat beritacovid ppkm,2
746,2022-08-06 11:22:12+00:00,kngyaz_,@callanooia INI KNP SI PLISS dr tdi ppkm 😢😢,kenapa pliss dr tdi ppkm ,1
7293,2022-08-20 03:30:00+00:00,Cintalisya,"Polri bersinergi dengan pemerintah agar masyarakat melakukan vaksinasi covid 19 .
#SinergitasProgramPemerintah
Bangkit Pulih Indonesia https://t.co/DbBBOpnScs",polri sinergi perintah masyarakat vaksinasi covid sinergitasprogrampemerintah bangkit pulih indonesia,1
3747,2022-08-30 03:25:58+00:00,republikaonline,Perpanjangan PPKM di Jawa-Bali dilakukan hingga 5 September 2022. https://t.co/iliQD2klxp,panjang ppkm jawa bal september,1
3277,2022-08-13 13:04:17+00:00,bluehoniee,@handeeep gatau jugaa dri tadi ppkm,gatau jugaa dri ppkm,1
3404,2022-08-12 13:18:34+00:00,belum_dilantik,@hosu_twt Mumpung udh free ppkm kak....,mumpung udah free ppkm kak,1
6979,2022-08-01 05:01:30+00:00,polsek_mojoroto,"@kediri_humas Personel Polwan turut membantu memberikan vaksinasi Covid-19 untuk masyarakat
#PerkuatJagaImunitas
Disiplin Protokol Kesehatan",personel polwan bantu vaksinasi covid masyarakat perkuatjagaimunitas disiplin protokol sehat,1
7603,2022-08-19 03:00:02+00:00,Abidin_0909,"Pencegahan penularan Covid 19 dengan Vaksinasi 
#BangkitPulihIndonesia
Sigap Tangani Pandemi https://t.co/PF8yNPeYwm",cegah tular covid vaksinasi bangkitpulihindonesia sigap tangan pandemi,2
7333,2022-08-20 01:33:30+00:00,Lazwardy1,Sehat selalu pak Kamaruddin Simanjuntak. Jgn lupa minum vitamin dan istirahat yg cukup biar dpt terus mengungkapkan kebenaran yg ada !. Jgn lupa vaksinasi  Covid-19 booster jg ya pak.,sehat kamaruddin simanjuntak lupa minum vitamin istirahat dpt benar lupa vaksinasi covid booster jg,2
5992,2022-08-05 10:03:53+00:00,OmbudsmanRI137,"Vaksinasi COVID-19 dosis keempat atau booster kedua sudah mulai diberikan sejak Jumat (29/7/2022) dan diberikan kepada tenaga kesehatan sebagai kelompok prioritas.

Untuk Sahabat Ombudsman, tetap jaga kesehatan dan selalu patuhi protokol kesehatan ya! 🙂",vaksinasi covid dosis empat booster jumat tenaga sehat kelompok prioritas sahabat ombudsman jaga sehat patuh protokol sehat ,2
5399,2022-08-09 01:00:22+00:00,chinta_chintata,"Vaksinasi booster dapat meningkatkan kekebalan komunitas 2 kali lipat dibanding dosis kedua.

Sehingga, vaksinasi booster diperlukan untuk melindungi orang tua &amp; kelompok masyarakat rentan atau memiliki komorbid dari penularan Covid-19.

#WajibBoosterPatuhProkes
Kita Bangsa Juara https://t.co/6W1I9U5BDp",vaksinasi booster tingkat kebal komunitas kali lipat banding dosis vaksinasi booster lindung orang tua kelompok masyarakat rentan milik komorbid tular covid wajibboosterpatuhprokes bangsa juara,2
7570,2022-08-19 03:38:12+00:00,radehjtt,"RT @wownewsofc: Polri Monitoring Vaksinasi 

Kegiatan monitoring polri di gerai vaksin dalam rangka Tranformasi Menuju Polri Yang Persisi M…",polri monitoring vaksinasi giat monitoring polri gerai vaksin rangka tranformasi polri persisi m,1
6685,2022-08-02 05:29:51+00:00,SakiinaQhiCO_33,RT @AlshaibaShihab: Kasus covid-19 melonjak dlm bbrp hari ini. Utk itu pemerintah menghimbau masyarakat segera melakukan vaksinasi booster…,covid lonjak dalam bbrp perintah menghimbau masyarakat vaksinasi booster,1
5817,2022-08-06 21:42:04+00:00,azzahraazzahro,"Pencegahan Peningkatan Kasus Varian Baru Covid-19 Dengan Vaksinasi

IKN Kemajuan Indonesi https://t.co/ByolKh6ua8",cegah tingkat varian covid vaksinasi ikn maju indonesi,2
3538,2022-08-11 14:45:36+00:00,nugasbego,Gak tau.. gua PPKM. Planga plongo kayak meng. Terus lewat sendiri https://t.co/Gp7C5DxIKj,gue ppkm planga plongo kayak meng,1
1128,2022-08-04 08:14:07+00:00,moorrw,@kwagaon Tapi muka ku terlalu cantik utk dijadikan meme ppkm :( .g,muka ku cantik jadi meme ppkm g,1
8874,2022-08-12 03:12:27+00:00,DoraemonTakesi,"@Inger_Marie_ Vaksinasi Booster Demi Cegah Lonjakan Kasus Covid-19. Ayo Vaksin Booster!

IKN Meratakan Pembangunan",vaksinasi booster cegah lonjak covid ayo vaksin booster ikn rata bangun,2
6156,2022-08-05 00:15:59+00:00,Jumanto13455507,"RT @kodimgrobogan: Bersinergi Kawal Vaksinasi

Babinsa Koramil 11/Gabus Sertu Maskun bersama Bhabinkamtibmas dan SatpolPP lakukan pendampin…",sinergi kawal vaksinasi babinsa koramil gabus sertu maskun bhabinkamtibmas satpolpp laku pendampin,1
9659,2022-08-27 01:01:37+00:00,ragumdzu,"Vaksinasi adalah kunci utama untuk melindungi diri sendiri dan orang-orang terdekat dari bahaya Covid-19 varian Omicron BA.4 dan BA.5 #SepakatDukungDOB #TolakReferendum
#qrty https://t.co/SSZ8PEzVMI",vaksinasi kunci utama lindung orang orang dekat bahaya covid varian omicron ba ba sepakatdukungdob tolakreferendum qrty,2
2498,2022-08-18 08:19:02+00:00,firstymungkadan,"Indonesia 5 Besar Vaksinasi Covid-19 Terbanyak di Dunia

#EndemiCovid
#IndonesiaSehatIndonesiaHebat
#BeritaCovid
#PPKM https://t.co/4qlCWEQJCM",indonesia vaksinasi covid dunia endemicovid indonesiasehatindonesiahebat beritacovid ppkm,1
5711,2022-08-07 10:01:29+00:00,DINKES_PROV_BKL,"Ikuti Vaksinasi 
Covid-19 Booster ke dua khusus Tenaga Kesehatan..🙏💪👍 https://t.co/0BM7jMajcZ",ikut vaksinasi covid booster khusus tenaga sehat ,1
2215,2022-08-20 03:08:00+00:00,youokarina,"@buiIdbiu oalaaah aku cuma tau aja, belum pernah kesana.. APA ITU PPKM?",oalaaah kesana ppkm,1
7821,2022-08-18 00:00:01+00:00,anawillm,"sat set hayuk, Ayo ikuti vaksinasi agar Tanah Papua terbebas dari belenggu Covid-19 varian baru Omicron BA.4 dan BA.5. #OtsusPapuaIstimewa #PapuaIndonesia https://t.co/HNZHGqSYv5",sat set hayuk ayo ikut vaksinasi tanah papua bebas belenggu covid varian omicron ba ba otsuspapuaistimewa papuaindonesia,2
402,2022-08-08 14:00:41+00:00,nocatchi,"@hurriciane Cocok lu ppkm pak, kembali ke habitat asli",cocok kamu ppkm habitat asli,1
4223,2022-08-27 01:40:04+00:00,Koramil01Byl,"3 orang Babinsa Koramil 01/Boyolali dipimpin Babinsa Mudal Serka Marsudi   bersama Polsek  Boyolali melaksanakan giat operasi Yustisi pelaksanaan PPKM Level 1 dalam rangka mencegah penyebaran Covid-19 di  Desa Mudal, Kec.Boyolali https://t.co/GsKGC8pBWb",orang babinsa koramil boyolali pimpin babinsa mudal serka marsudi polsek boyolali laksana giat operasi yustisi laksana ppkm level rangka cegah sebar covid desa mudal kec boyolali,1
9902,2022-08-26 01:01:06+00:00,KatokRombeng,"Pemerintah Gencarkan Vaksinasi COVID-19 Lanjutan Di Daerah Imunitas Rendah.!!

#KomitmenMembangunNKRI https://t.co/OKdXKpAij2",perintah gencar vaksinasi covid lanjut daerah imunitas rendah komitmenmembangunnkri,1
9642,2022-08-27 02:41:04+00:00,stefanireu,Vaksinasi Covid-19 berguna untuk kekebalan tubuh sehingga dapat menangkal penyebaran virus covid-19. #SepakatDukungDOB #PapuaIndonesia https://t.co/rWffugYnc8,vaksinasi covid guna kebal tubuh tangkal sebar virus covid sepakatdukungdob papuaindonesia,2
6062,2022-08-05 02:33:26+00:00,Andiriego_,"RT @Penyair_Berdiri: Vaksin booster percepat peningkatan kekebalan komunal.
Vaksinasi merupakan kebutuhan pokok yang bertujuan agar masyara…",vaksin booster cepat tingkat kebal komunal vaksinasi butuh pokok tuju masyara,2
6871,2022-08-01 13:28:16+00:00,kumparan,Nakes pada minggu berjalan ini akan menerima Vaksinasi COVID-19 dosis Booster ke-2 di fasilitas kesehatan tempat Nakes tersebut bertugas atau di gerai pelayanan Vaksinasi COVID-19. #publisherstory https://t.co/0FPdIb2mHw,nakes minggu jalan terima vaksinasi covid dosis booster fasilitas sehat nakes tugas gerai layan vaksinasi covid publisherstory,1
5986,2022-08-05 10:44:17+00:00,Mpon_Mponn,"RT @NandaBaskarani: Pemerintah terus mendorong kemandirian untuk vaksinasi covid 19 yang dipakai untuk masyarakat Indonesia.
Kementerian BU…",perintah dorong mandiri vaksinasi covid pakai masyarakat indonesia menteri bu,1
3054,2022-08-14 23:38:51+00:00,sejakkalaitu,apa ya aku melakukan aktivitas ppkm lg,aktivitas ppkm lg,1
9014,2022-08-11 06:50:33+00:00,humaslapasgtlo,"Heni Susila Wardoyo menyampaikan bahwa selain untuk menyemarakkan peringatan Hari Dharma Karya Dhika ke-77, kegiatan ini juga dilaksanakan sebagai bentuk dukungan kebijakan pemerintah dalam Gerakan vaksinasi lanjutan Covid-19,",heni susila wardoyo semarak ingat dharma karya dhika giat laksana bentuk dukung bijak perintah gera vaksinasi lanjut covid,2
5474,2022-08-08 08:18:00+00:00,ChannelRedaksi,Babinsa Koramil Selorejo Bantu Kegiatan Vaksinasi Covid 19 https://t.co/PIqGTBHeL5,babinsa koramil selorejo bantu giat vaksinasi covid,1
772,2022-08-06 09:00:01+00:00,IndonesiaBaikId,"Hai SohIB! Untuk mengantisipasi importasi kasus dari pelaku perjalanan internasional, pemerintah memperketat pintu masuk ke Indonesia.

#IndonesiaBaik #YangMudaSukaData #ProgramPemerintah #Infografis #PPKM #SyaratPerjalanan #COVID19 #KominfoNewsroom https://t.co/fpIxYWkpUn",hai sohib antisipasi importasi laku jalan internasional perintah ketat pintu masuk indonesia indonesiabaik yangmudasukadata programpemerintah infografis ppkm syaratperjalanan covid kominfonewsroom,1
9176,2022-08-30 04:32:02+00:00,Mbokayu__,"Melaporkan terjadinya penambahan terkait tingkat vaksinasi covid 19 secara nasional

#StrategiDorongEkonomiRI https://t.co/1gi2itqIkf",lapor tambah kait tingkat vaksinasi covid nasional strategidorongekonomiri,1
9824,2022-08-26 03:27:57+00:00,polsek_kebbaru,"Rangkaian HUT Polwan Potret personel Polwan RI saat memberikan vaksinasi Covid-19 kepada masyarakat diwilayah Kabupaten Bangli,Provinsi Bali Kegiatan tsb sebagai upaya dlm mempercepat akselerasi vaskinasi, serta dalam rangka memperingati Hari Jadi Ke-74 #SrikandiBhayangkaraPeduli https://t.co/W6ND4dc7Ac",rangkai hut polwan potret personel polwan ri vaksinasi covid masyarakat wilayah kabupaten bangli provinsi bal giat sebut upaya dalam cepat akselerasi vaskinasi rangka ingat srikandibhayangkarapeduli,2
3296,2022-08-13 10:49:25+00:00,fleurnuite,"Real, ppkm https://t.co/i8FzsDSBn9",real ppkm,1
5377,2022-08-09 02:32:03+00:00,LuisChaniago,"Selain vaksinasi, prokes efektif tangkal Covid-19
Bangga Cinta TanahAir https://t.co/gY6i9H7f7N",vaksinasi prokes efektif tangkal covid bangga cinta tanahair,2
2107,2022-08-01 01:31:37+00:00,Iooviese,"ini kalo anglenya didepan muka dia, kayanya lagi ppkm https://t.co/Ygt0tRWf02",anglenya depan muka kaya ppkm,1
404,2022-08-08 13:49:13+00:00,sullyooy,@yonwou AAA SEMANGAT MAIN GAMESNYA KAK! aku lagi ppkm aja nih planga plongo kaya mmm apa yah,aaa semangat main gamesnya kak ppkm planga plongo kaya mmm,1
899,2022-08-05 13:03:37+00:00,junkuyi,"@sujewong Aftie, nuna! Planku cuma ppkm ajah hari ini...",aftie nuna plan ppkm ajah,1
7214,2022-08-20 03:34:50+00:00,Andiriego_,RT @Anggita_lung: Kemenkes  telah  meliris surat  edaran vaksinasi covid-19 dosis ke empat atau booster kedua bagi Tenaga Kesehatan di Indo…,kemenkes lir surat edar vaksinasi covid dosis booster tenaga sehat indo,1
2395,2022-08-19 02:21:06+00:00,kumparan,Ketua OKK UI menyebut acara ini kembali diselenggarakan secara luring setelah menerima arahan kampus dengan memperhatikan pelaksanaan PPKM yang saat ini berada di level 1. #kumparanNews https://t.co/UOjUPVT7YP,ketua okk ui sebut acara selenggara luring terima arah kampus perhati laksana ppkm level kumparannews,2
9461,2022-08-28 10:16:12+00:00,PolsekMengwi57,"Bhabinkamtibmas Desa Sembung Aiptu Dewa Ketut Putra Arsana atensi kegiatan Vaksinasi Covid 19 di Balai Banjar Pempatan, Desa Sembung, Kecamatan Mengwi, Kabupaten Badung. Minggu (28/8) pukul 08.00 wita https://t.co/rqahLqvEJz",bhabinkamtibmas desa sembung aiptu dewa ketut putra arsana atensi giat vaksinasi covid balai banjar pempatan desa sembung camat mengwi kabupaten badung minggu wita,1
9841,2022-08-26 03:00:58+00:00,shafiraajadeh,"Vaksinasi demi bentengi diri dari covid 19 #SrikandiBhayangkaraPeduli
Rangkaian HUT Polwan https://t.co/2VDOTzEhqN",vaksinasi benteng covid srikandibhayangkarapeduli rangkai hut polwan,2
877,2022-08-05 15:34:01+00:00,kesurupanmaung,Memasuki waktu PPKM: Pengen Pacaran Kemudian Menikah.,pasuk ppkm ken pacar meni,1
3166,2022-08-14 06:26:39+00:00,sejerong,@dacvikah Ikutan ppkm juga aku *bengong*,ikut ppkm bengong,1
5126,2022-08-10 06:36:16+00:00,dinda_fenti,Sri Sultan HB X Minta Masyarakat Jalani Vaksinasi Booster untuk Tekan Penularan Covid-19 | NKRI Bangsa Kuat #RiauDamai https://t.co/N9r5MZUiYL.,sri sultan hb x masyarakat jalan vaksinasi booster tekan tular covid nkri bangsa kuat riaudamai,2
5641,2022-08-08 01:18:18+00:00,dionnabura,Vaksinasi Booster Bisa Cegah Rawat Inap Karena Covid-19 https://t.co/X3bCR89x1b,vaksinasi booster cegah rawat inap covid,2
3974,2022-08-29 02:02:50+00:00,g00dm0aning,@puterankecil Hayooo 2 minggu kmrn udah kmn aja tanpa protokol PPKM? 😅,hayooo minggu kemarin udah kmn protokol ppkm ,1
8928,2022-08-12 00:00:28+00:00,gandhiptr,Vaksinasi Covid-19 berguna untuk kekebalan tubuh sehingga dapat menangkal penyebaran virus covid-19. Yuk segera vaksinasi dan lengkapi dosianya jangan lupa untuk selalu patuhi protokol kesehatan dimanapun berada #DOBPentingUntukPapua #PapuaIndonesia https://t.co/z7VlsXbckH,vaksinasi covid guna kebal tubuh tangkal sebar virus covid yuk vaksinasi lengkap dosianya lupa patuh protokol sehat mana dobpentinguntukpapua papuaindonesia,2
4635,2022-08-24 02:09:31+00:00,KramatJa3,IPDA MUSTOFA PIMPIN GIAT OPS GABUNGAN DALAM RANGKA PENDISIPLINAN MASYARAKAT TERKAIT PENERAPAN PEMBATASAN KEGIATAN MASYARAKAT (PPKM LEVEL 1) DI WILAYAH HUKUM POLSEK KRAMATJATI JAKARTA TIMUR https://t.co/hRxYdaNiV3,ipda mustofa pimpin giat ops gabung rangka disiplin masyarakat kait terap batas giat masyarakat ppkm level wilayah hukum polsek kramatjati jakarta timur,1
6049,2022-08-05 03:13:55+00:00,rinairin965,"@VIVAbola @VIVAcoid Kasus COVID-19 Meningkat, Taat Prokes dan Vaksinasi Lengkap
Indonesia Negeri Maju https://t.co/9fnKiNzofZ",covid tingkat taat prokes vaksinasi lengkap indonesia negeri maju,1
5624,2022-08-08 02:11:56+00:00,BayuUno11,"Disiplin Prokes dan Vaksinasi  masih merupakan benteng ampuh mencegah diri pribadi dan orang lain dari penularan varian Covid-19.

IKN Smartcity Indonesia https://t.co/VmAnfBvUDD",disiplin prokes vaksinasi benteng ampuh cegah pribadi orang tular varian covid ikn smartcity indonesia,2
308,2022-08-09 03:54:15+00:00,toastyless,@ArsonistFrogg Pee Pee Ketchup Man (ppkm),pee pee ketchup man ppkm,1
5642,2022-08-08 01:12:01+00:00,catatankaqihati,"Selain itu, Dokter Spesialis Paru DR dr Agus Dwi Susanto
Sp P(K) mengungkapkan vaksinasi juga tuk mencegah gejala berat serta long covid paska terinfeksi dr covid 19.
#ProkesBoosterTetapJalan 
Senin Pagi https://t.co/GKRm4qna6i",dokter spesialis paru dr dr agus dwi susanto sp p k vaksinasi tuk cegah gejala berat long covid paska infeksi dr covid prokesboostertetapjalan senin pagi,1
4295,2022-08-26 08:28:15+00:00,INTELKAMPSP1,Monitoring Pelaksanaan Operasi Yustisi  tentang Pemberlakuan  Pembatasan Kegiatan Masyarakat (PPKM) dan penerapan disiplin / penegakan hukum protokol kesehatan sebagai upaya pencegahan dan pengendalian Corona Virus Disease-19 di wilayah Kota Padangsidimpuan. https://t.co/IMdCkZJ6mH,monitoring laksana operasi yustisi laku batas giat masyarakat ppkm terap disiplin tega hukum protokol sehat upaya cegah kendali corona virus disease wilayah kota padangsidimpuan,2
6525,2022-08-03 02:13:04+00:00,stefanireu,Vaksinasi Covid-19 berguna untuk kekebalan tubuh sehingga dapat menangkal penyebaran virus covid-19. #DukungTerusDOBdanOtsus #PapuaIndonesia https://t.co/fQpB6NjxbC,vaksinasi covid guna kebal tubuh tangkal sebar virus covid dukungterusdobdanotsus papuaindonesia,2
10666,2022-08-22 03:39:55+00:00,sekdemang43,"RT @PolresProboKota: @HumasPoldaJatim Vaksinasi Lindungi Kita Dari Corona #WujudkanPemulihanEkonomi

Kawal Investasi Nasional  Personel Kor…",vaksinasi lindung corona wujudkanpemulihanekonomi kawal investasi nasional personel kor,2
1592,2022-08-02 10:15:37+00:00,mildnblue,Lhoo ini krsnya sistem war kirain di paketin kaya kemaren mana aku udah ppkm https://t.co/ArdC8CTz07,lhoo krsnya sistem war kirain paketin kaya kemaren udah ppkm,1
5720,2022-08-07 07:44:33+00:00,beritacovid,"#Infografis Monitoring Data Covid-19 dan Update Vaksinasi, Minggu 7 Agustus 2022 - https://t.co/k5MRKOTZqC #Covid #Covid19 https://t.co/bntDgQb7TR",infografis monitoring data covid update vaksinasi minggu agustus covid covid,1
8228,2022-08-16 04:03:11+00:00,humasbandung_,"RT @ppidkotabandung: [ UPDATE STATISTIK COVID-19 DI KOTA BANDUNG PER TANGGAL 15 AGUSTUS 2022 ]

Halo, Wargi Bandung!
Berikut update data Co…",update statistik covid kota bandung tanggal agustus halo wargi bandung update data co,1
4010,2022-08-28 15:54:50+00:00,JunGGocs,RT @odythoughts: @ssefnum Pengangguran musuhnya tanggal muda. Bukan ke tanggal nya sih. Tapi kek iri aja liat temen temen yang kerja gajian…,anggur musuh tanggal muda tanggal kek iri liat temen temen kerja gaji,1
8412,2022-08-15 02:00:44+00:00,PakRT03,"RT @lawancovid19_id: Catatan di dalamnya mencakup lini masa kebijakan dan dinamika penanganan pandemi,  upaya pemerintah mendatangkan vaksi…",catat dalam cakup lini bijak dinamika tangan pandemi upaya perintah vaksi,1
10278,2022-08-23 14:13:56+00:00,medianekita,"Vaksinasi Covid-19 Dosis ke 1, 2 dan Booster Hadir Kembali di LGF Plaza Asia Tasikmalaya, 24 Agustus 2022 https://t.co/ILhmJOHQoY",vaksinasi covid dosis booster hadir lgf plaza asia tasikmalaya agustus,1
7549,2022-08-19 03:58:20+00:00,LuisChaniago,"Prokes dan vaksinasi solusi utama terhindar dari Covid-19
NKRI Bangsa Hebat https://t.co/S6wxro3S1q",prokes vaksinasi solusi utama hindar covid nkri bangsa hebat,1
2094,2022-08-01 02:38:32+00:00,MbauNinda,"Pemerintah Telah Mempersiapkan 2 Laboratorium Untuk Antisipasi Penularan Serta Uji Sempel Cacar Monyet. 
#EndemiCovid
#IndonesiaSehatIndonesiaHebat
#BeritaCovid
#PPKM https://t.co/de7S4AjBPl",perintah laboratorium antisipasi tular uji sempel cacar monyet endemicovid indonesiasehatindonesiahebat beritacovid ppkm,1
10377,2022-08-23 01:09:59+00:00,KangCendol_33,"Satuan tugas Covid-19 melaporkan sebanyak 57,5 juta dosis vaksin Booster telah dibagikan pada masyarakat. Pemerintah akan terus mengupayakan pencapaian vaksinasi guna memperkuat Herd Immunity. 
Patuhi Vaksinasi &amp; disiplin prokes 

#JanganAbaiDisiplinProkes
Kita Satria Indonesia https://t.co/IvoYMmX7R2",satu tugas covid lapor juta dosis vaksin booster bagi masyarakat perintah upaya capai vaksinasi kuat herd immunity patuh vaksinasi disiplin prokes janganabaidisiplinprokes satria indonesia,2
6246,2022-08-04 05:44:35+00:00,PolresKutim,Personil Polsek Muara Bengkal Pantau Pelaksanaan Percepatan Vaksinasi Covid-19 https://t.co/n4tnlxoYQh,personil polsek muara bengkal pantau laksana cepat vaksinasi covid,1
2534,2022-08-18 03:06:54+00:00,sihimjake,@ofArmonise Lupa ngetweet terus jadi ppkm gak?,lupa ngetweet ppkm,1
9936,2022-08-26 01:00:01+00:00,Rendi94353157,Dengan sudah melakukan vaksinasi Covid-19 maka berguna untuk meningkatkan kekebalan tubuh sehingga dapat menangkal penyebaran virus covid-19. #DukungDOBDemiKemajuan #PapuaIndonesia https://t.co/tSSapsaOce,vaksinasi covid guna tingkat kebal tubuh tangkal sebar virus covid dukungdobdemikemajuan papuaindonesia,2
2079,2022-08-01 03:53:24+00:00,DAmfeto,"RT @DAmfeto: Siapkan laboratorium untuk mendukung pemerintah dalam mengantisipasi penyebaran penyakit tersebut
#EndemiCovid
#IndonesiaSehat…",siap laboratorium dukung perintah antisipasi sebar sakit endemicovid indonesiasehat,1
7583,2022-08-19 03:28:01+00:00,EkoPurw97658480,"@multimediagrob E Sebagai upaya #BangkitPulihIndonesia percepatan vaksinasi Covid-19, jajaran Korps Bhayangkara menjadi garda terdepan sebagai vaksinator Sigap Tangani Pandemi",e upaya bangkitpulihindonesia cepat vaksinasi covid jajar korps bhayangkara garda depan vaksinator sigap tangan pandemi,1
6610,2022-08-02 13:52:11+00:00,soloposdotcom,"Dinkes Boyolali Siap Vaksinasi Covid-19 Dosis Keempat, Kapan Jadwalnya? https://t.co/6XARG0oLjp",dinkes boyolali vaksinasi covid dosis empat jadwal,1
7577,2022-08-19 03:30:19+00:00,ResNgawi,"Mohon dukungannya untuk warga negara Indonesia, agar negara kita bisa segera pulih kembali. Mari sukseskan vaksinasi Covid-19.🇲🇨

Jangan lupa ikuti vaksinasi di daerahmu masing-masing ya.😊
#BangkitPulihIndonesia
Sigap Tangani Pandemi https://t.co/KisM8kYXXe",mohon dukung warga negara indonesia negara pulih mari sukses vaksinasi covid  lupa ikut vaksinasi daerah  bangkitpulihindonesia sigap tangan pandemi,2
4888,2022-08-22 06:52:44+00:00,KodimKarangany1,KARANGANYAR - Senin 22 Agustus 2022 Serda Sudarno dan Serda Guntur Prabowo anggota Koramil 05/Mojogedang bersama anggota Satpol PP Kec. Mojogedang melaksanakan Patroli Prokes PPKM Level 3 di pasar Jambangan menghimbau dan membagikan masker kepada pedagang/pengunjung pasar. https://t.co/ONwTw4H4vh,karanganyar senin agustus serda sudarno serda guntur prabowo anggota koramil mojogedang anggota satpol pp kec mojogedang laksana patroli prokes ppkm level pasar jambang menghimbau bagi masker dagang unjung pasar,1
2905,2022-08-15 17:38:54+00:00,RamilGemolong,"Pada Minggu 14 Agustus 2022 Pkl 20.00 WIB  s.d selesai telah dilaksanakan Giat patroli gabungan  bersama Polsek Sumberlawang dalam rangka  Pelaksanaan Patroli PPKM LEVEL I membatasi Mobilitas Perpindahan Masyarakat, bertempat di wilayah kecamatan Sumberlawang. https://t.co/JeboGn01gJ",minggu agustus pkl wib s selesai laksana giat patroli gabung polsek sumberlawang rangka laksana patroli ppkm level i batas mobilitas pindah masyarakat tempat wilayah camat sumberlawang,1
7791,2022-08-18 02:10:16+00:00,SutanSegehh,"Pentingnya Vaksinasi Demi Terciptanya Herd Immunity &amp; Cegah Tertular Varian Covid-19

Indonesia Bangkit Bertumbuh https://t.co/3Vgbyevie4",vaksinasi cipta herd immunity cegah tular varian covid indonesia bangkit tumbuh,2
1817,2022-08-02 01:08:33+00:00,frappechinos,@convomf ppkm doang anj gweh alias planga plongo kaya monyet,ppkm doang anjing gweh alias planga plongo kaya monyet,0
