Column,Date,User,Tweet,Tweet Bersih,Sentiment
1702,2022-08-02 05:19:08+00:00,halloriau,"Meski Kasus Naik, Pekanbaru Masih Tetap PPKM Level 1
https://t.co/R7qKO98AYE",pekanbaru ppkm level,1
819,2022-08-06 04:10:21+00:00,nayibydna,@otongkoil Wkwkwk terbatas karna jam PPKM,wkwkwk batas karena jam ppkm,1
1056,2022-08-04 16:56:18+00:00,boysyahbana,"Bahkan dengan kebijakan yang diperketat lagi, sepertinya sulit untuk dorong publik berwaspada. Kini, level ppkm apapun praktiknya cuman beti saja, apalagi pengawasannya juga sudah kendor... https://t.co/DJDMkWET6d",bijak ketat sulit dorong publik waspada level ppkm apa praktik cuman beti awas kendor,0
27,2022-08-10 06:21:18+00:00,nimu123456,"Ikatn drama, Ya emang nmx jg DRAMA seri

Ikatan pocong, ik gatel, ik gremet2
Trs ngapain minta al msk lagi. Mau ya al jd pocongx trs minta garuk gatel gremet2 ppkm lev.smesta soalx

Maaf banget, smpe sgitu jijikx nistain tp ngarep idolax balik, trs ngatain yg msh nonton bodoh",ikatn drama emang nmx jg drama seri ikat pocong ik gatel ik gremet terus ngapain al msk al pocongx terus garuk gatel gremet ppkm lev smesta soalx maaf banget sampai sgitu jijikx nistain tp ngarep idolax terus ngatain msh nonton bodoh,1
6364,2022-08-04 00:00:34+00:00,xanderrdarma,"Ingat untuk jangan lupa tetap menerapkan protokol kesehatan dimanapun berada demi memutuskan penyebaran Covid-19, meskipun sudah mendapatkan vaksinasi dosis ketiga karena varian baru Omicron BA.4 dan BA.5 masih mengintai. #PemekaranSejahterakanPapua #PapuaIndonesia https://t.co/c9FIObazeU",lupa terap protokol sehat mana putus sebar covid vaksinasi dosis tiga varian omicron ba ba intai pemekaransejahterakanpapua papuaindonesia,2
2985,2022-08-15 08:05:55+00:00,cheeirry,"@winteux kan jaga jarak, ppkm",jaga jarak ppkm,1
10185,2022-08-24 04:04:05+00:00,Andiriego_,"RT @riego_see: Ayo ikut vaksinasi Covid-19 untuk meningkatkan daya tahan tubuh, Pemberian vaksinasi diperlukan untuk merangsang sistem imun…",ayo vaksinasi covid tingkat daya tahan tubuh beri vaksinasi rangsang sistem imun,2
10933,2022-08-21 01:27:20+00:00,PolsekCangkuang,"Bhabinkamtibmas Polsek Cangkuang Dampingi Team Vaksinator BEDAS Kabupaten Bandung, Persiapan Pelaksanaan Vaksinasi Covid-19 di Lokasi Wisata Air Hantap
 ...
@humaspoldajbr
@polrestabandung 
@DitBinmasJabar
@Binmassoreang
@Dd_humaspldjbr https://t.co/UFll8yj332",bhabinkamtibmas polsek cangkuang damping team vaksinator bedas kabupaten bandung siap laksana vaksinasi covid lokasi wisata air hantap,1
8355,2022-08-15 07:39:37+00:00,CNNIDdaily,"Menteri Kesehatan, Budi Gunadi Sadikin berencana fokus pada akselerasi vaksinasi booster Covid-19 pertama kepada masyarakat Indonesia, sebelum melaksanakan pemberian booster kedua. https://t.co/ns6OyEyJew https://t.co/KlwgIXnuzO",menteri sehat budi gunadi sadikin rencana fokus akselerasi vaksinasi booster covid masyarakat indonesia laksana beri booster,1
3309,2022-08-13 08:17:08+00:00,ieljpg,@rvabiit awas ppkm,awas ppkm,1
8690,2022-08-13 00:00:02+00:00,Andani_201,Guys bner nih Vaksinasi adalah kunci utama untuk melindungi diri sendiri dan orang-orang terdekat dari bahaya Covid-19 varian Omicron BA.4 dan BA.5 #DOBBerikanDampakPositif #PapuaIndonesia https://t.co/pHeO3lfAAs,guys benar vaksinasi kunci utama lindung orang orang dekat bahaya covid varian omicron ba ba dobberikandampakpositif papuaindonesia,2
6817,2022-08-02 01:33:21+00:00,PemdaKotaCrb,"Update pencapaian vaksinasi Covid-19 di Kota Cirebon       
Sabtu, 30 Juli 2022 
 
Sumber: Dinkes Kota Cirebon 
Klik untuk info situasi Covid-19 terkini di Kota Cirebon: https://t.co/Ncyut0C4Gu  
     
#wongcerbonlawancovid19 #vaksinkotacirebon https://t.co/1AK0HGVeOd",update capai vaksinasi covid kota cirebon sabtu juli sumber dinkes kota cirebon klik info situasi covid kini kota cirebon wongcerbonlawancovid vaksinkotacirebon,1
3741,2022-08-30 03:44:47+00:00,AndreLauzcx,@virusketik ebagaimana PPKM leveling yang ditetapkan denga,ebagaimana ppkm leveling tetap denga,1
3412,2022-08-12 12:16:20+00:00,wintfeo,@renqun lesehan depan si isa aja kita smbil ppkm liatin tamunya,leseh isa smbil ppkm liatin tamu,1
7343,2022-08-20 00:16:13+00:00,alira_citra,"Jangan lupa untuk semuanya tetap menerapkan protokol bagi kesehatan demi memutuskan penyebaran Covid-19, meskipun sudah mendapatkan vaksinasi dosis ketiga karena varian baru Omicron BA.4 dan BA.5 masih mengintai dan bisa menyerang kapan saja
 #ManfaatOtsusTakTerhingga https://t.co/DcNeskftKb",lupa terap protokol sehat putus sebar covid vaksinasi dosis tiga varian omicron ba ba intai serang manfaatotsustakterhingga,2
10969,2022-08-21 01:00:00+00:00,breiln1,"Siapa nih yang belum vaksin? Buruan ya
----
Vaksinasi adalah kunci utama untuk melindungi diri sendiri dan orang-orang terdekat dari bahaya Covid-19 varian Omicron BA.4 dan BA.5 #DOBdanOtsusAspirasiPapua #PapuaIndonesia https://t.co/bxipsuqlZN",vaksin buru vaksinasi kunci utama lindung orang orang dekat bahaya covid varian omicron ba ba dobdanotsusaspirasipapua papuaindonesia,2
6828,2022-08-02 01:00:57+00:00,KangCendol_33,"Meningkatnya kasus Covid-19 belakangan ini membuat kita harus waspada, Pemerintah menghimbau agar masyarakat yg belum melaksanakan vaksinasi booster agar segera mendapatkannya krn booster penting utk meredam kenaikan kasus Covid-19

#WajibVaksinDisiplinProkes 
Agustus 2022 ✔️✔️ https://t.co/pToZS2C0Xf",tingkat covid waspada perintah menghimbau masyarakat laksana vaksinasi booster dapat booster redam naik covid wajibvaksindisiplinprokes agustus ,1
3495,2022-08-12 02:31:58+00:00,Nguter02,Sertu Fredy anggota Koramil 02 Nguter melaksanakan operasi yustisi PPKM level I memberikan edukasi dan himbauan kepada warga masyarakat yang kedapatan tidak memakai masker untuk tetap menjalankan protkes dalam kegiatan sehari-hari https://t.co/E92o8ILeJI,sertu fredy anggota koramil nguter laksana operasi yustisi ppkm level i edukasi himbauan warga masyarakat dapat pakai masker jalan protkes giat hari,2
3328,2022-08-13 06:11:21+00:00,Windi_aja21,"Vaksi terbukti meningkatkan antibodi
#EndemiCovid
#IndonesiaSehatIndonesiaHebat
#BeritaCovid
#PPKM https://t.co/e6zbpioDe4",vaksi bukti tingkat antibodi endemicovid indonesiasehatindonesiahebat beritacovid ppkm,2
10456,2022-08-22 07:17:49+00:00,CNNIDdaily,"Pemberian vaksin booster kedua, atau dosis keempat vaksin Covid-19, telah dimulai sejak 29 Juli 2022 untuk nakes sebagai penerima pertama. Vaksinasi tersebut dilaksanakan berdasarkan skala prioritas, yaitu tenaga kesehatan, lansia, dan penderita komorbid. https://t.co/ns6OyEyJew https://t.co/BAg8buVBNf",beri vaksin booster dosis empat vaksin covid juli nakes terima vaksinasi laksana dasar skala prioritas tenaga sehat lansia derita komorbid,1
3226,2022-08-13 22:27:41+00:00,hyeese,ppkm ( pengen pacarandgn kim mingyu ),ppkm ken pacarandgn kim mingyu,1
4646,2022-08-24 00:15:39+00:00,SFT95JOSHUA,"1. Manjat pohon demi mbak mantan
2. Juara 3 basket ISAC
3. Terima kasih sudah menjadi sobat ghibah gw, keep mengghibah!
4. Hmmm... kayanya sifut lagi ada ppkm
5. SFT04REI sini kenalan sama om",manjat pohon mbak mantan juara basket isac terima kasih sobat ghibah saya keep mengghibah hmmm kaya sifut ppkm sftrei kenal om,1
8471,2022-08-14 10:40:05+00:00,PolsekCangkuang,"Ucapan Terima Kasih Kapolsek Cangkuang Polresta Bandung, kepada "" Klinik Ratnasari Sehat Ciluncat "" yang telah mendukung Percepatan Vaksinasi Covid-19, sebagai Vaksinator Gerai Vaksin Presisi "".
...
@humaspoldajbr
@polrestabandung 
@DitBinmasJabar
@Dd_humaspldjbr https://t.co/XvcHB2AXSI",ucap terima kasih kapolsek cangkuang polresta bandung klinik ratnasari sehat ciluncat dukung cepat vaksinasi covid vaksinator gerai vaksin presisi,1
2732,2022-08-16 12:12:54+00:00,Iavecder,@convomfs ppkm nder. plonga plongo kyk monsky,ppkm nder plonga plongo seperti monsky,1
3681,2022-08-30 07:40:14+00:00,AryoDek0,"RT @DwiKilaw: Mulai Hari ini Naik Kereta Jarak Jauh Wajib Vaksin Booster.
#EndemiCovid
#BeritaCovid #PPKM
#IndonesiaSehatIndonesiaHebat htt…",kereta jarak wajib vaksin booster endemicovid beritacovid ppkm indonesiasehatindonesiahebat htt,1
8265,2022-08-16 02:32:21+00:00,Hms44826300,Giat percepatan Vaksinasi Covid 19 Polsek Batuceper membuka gerai Vaksinasi Booster Merdeka di aula Presisi Polsek Batuceper Jl. Daan Mogot Km 21 Kelurahan Batuceper Kecamatan Batuceper Kota Tangerang. https://t.co/h9BCEW9h9H,giat cepat vaksinasi covid polsek batuceper buka gerai vaksinasi booster merdeka aula presisi polsek batuceper jl daan mogot km lurah batuceper camat batuceper kota tangerang,1
5133,2022-08-10 06:01:07+00:00,kembang_asem,"RT @GratisTerbaik: Are you ready @jokowi ?
Gugatan ""Diskriminasi berdasarkan status vaksinasi"" akan diajukan hari rabu besok tgl 10 Agustus…",are you ready gugat diskriminasi dasar status vaksinasi aju rabu besok tanggal agustus,1
2312,2022-08-19 12:12:35+00:00,JlBSOO,"@jungwonaa Kenapa planga plongo, jangan ppkm 😭",planga plongo ppkm ,0
6533,2022-08-03 02:01:16+00:00,Ranisor,"@Penyair_Berdiri @Anggita_lung Vaksinasi covid-19 berguna untuk kekebalan tubuh mengurangi resiko penularan covid-19 
#ProkesBoosterHadangCovid
Rabu Pagii",vaksinasi covid guna kebal tubuh kurang resiko tular covid prokesboosterhadangcovid rabu pagi,2
10694,2022-08-22 03:25:27+00:00,danchaiyin,"Polri seutuhnya siap menopang program vaksinasi Covid-19 kegunaan mewujudkan masyarakat yang sehat, ekonomi kuat dan makin lama produktif

#WujudkanPemulihanEkonomi

Kawal Investasi Nasional",polri utuh topang program vaksinasi covid guna wujud masyarakat sehat ekonomi kuat produktif wujudkanpemulihanekonomi kawal investasi nasional,1
881,2022-08-05 15:08:57+00:00,AhmadDillahDiqi,@FCBarcelona @lewy_official Sek PPKM iki rupane.. Ketoro gak full seng ndelok..,sek ppkm iki rupane toro full seng ndelok,1
6554,2022-08-03 00:19:34+00:00,Molenmanis1,"Vaksinasi adalah kunci utama untuk melindungi diri sendiri dan orang-orang terdekat dari bahaya Covid-19 varian Omicron BA.4 dan BA.5.
Ayo kita vaksin! 
#DukungTerusDOBdanOtsus #PapuaIndonesia https://t.co/uL6YO9aK0a",vaksinasi kunci utama lindung orang orang dekat bahaya covid varian omicron ba ba ayo vaksin dukungterusdobdanotsus papuaindonesia,2
10479,2022-08-22 05:38:03+00:00,rizan3_trg,"Gerai Vaksinasi Presisi merupakan wujud kepedulian Polri di dalam penanganan covid 19 usaha memutus mata rantai penyebaran virus covid 19 supaya tercipta kondisi Harkamtibmas yang safe dan kondusif.

#WujudkanPemulihanEkonomi

Kawal Investasi Nasional https://t.co/kjBHK0HQtn",gerai vaksinasi presisi wujud peduli polri tangan covid usaha putus mata rantai sebar virus covid cipta kondisi harkamtibmas safe kondusif wujudkanpemulihanekonomi kawal investasi nasional,1
2884,2022-08-15 23:54:01+00:00,TO_Rametsi89,"RT @tauberitamedia: Seluruh Indonesia kini masuk PPKM level 1 termasuk Jabodetabek, bagaimana aturan terbarunya? Simak selengkapnya di sini…",indonesia masuk ppkm level jabodetabek atur baru simak lengkap sini,1
937,2022-08-05 09:12:39+00:00,umkm_ppkm,@Geraldy_Ulzzang Kon ripiu IBU bang,kon ripiu bang,1
126,2022-08-09 17:04:19+00:00,teackook,"semoga akkk bsk di job fair ga ppkm, planga plongo kaya monyet👍",moga akkk besok job fair ppkm planga plongo kaya monyet,1
6682,2022-08-02 06:15:18+00:00,rmoljateng,"Tekan Kasus Covid-19, Dinkes Upayakan #Vaksinasi Booster Bisa Capai 80 Persen #klikRMOL
https://t.co/aVG6mVg0v3",tekan covid dinkes upaya vaksinasi booster capai persen klikrmol,1
2462,2022-08-18 12:58:18+00:00,Summeryblue_,@UaRMyhob Loh masih ppkm? INI SEPUPU GUE KAGAK BALIK ANJIR SUMPAH 😭😭😭 GUE GAK MAKAN 😭,ppkm sepupu saya kagak anjir sumpah  saya makan ,1
9770,2022-08-26 07:34:00+00:00,tribunusbali,"I've just posted a new blog: Sholat Jumat Di Blahbatuh, Polsek Lakukan Pengamanan Dan Sosialisasikan Vaksinasi Covid-19 https://t.co/ggBOfzAfVC",i ve just posted a new blog sholat jumat blahbatuh polsek laku aman sosialisasi vaksinasi covid,1
9532,2022-08-28 02:15:09+00:00,Traffic_Jogja,SATGAS COVID-19; SEBANYAK 282.653 ORANG TELAH MENERIMA VAKSINASI BOOSTER KEDUA,satgas covid orang terima vaksinasi booster,1
9132,2022-08-30 08:57:48+00:00,DeJurnalcom,"Sukseskan Percepatan Vaksinasi , Bhabinkamtibmas Sukapura Polsek Utbar Polres Ciko Kawal Vaksin Covid 19 warga https://t.co/V4xNrfOWDI",sukses cepat vaksinasi bhabinkamtibmas sukapura polsek utbar polres ciko kawal vaksin covid warga,1
4915,2022-08-22 03:05:07+00:00,DwiKilaw,"Capaian Baru 25 Persen, Satgas Ingatkan Kerabat lain untuk Vaksinasi Booster.
#EndemiCovid
#BeritaCovid #PPKM
#IndonesiaSehatIndonesiaHebat https://t.co/gNl2mUAY8R",capai persen satgas ingat kerabat vaksinasi booster endemicovid beritacovid ppkm indonesiasehatindonesiahebat,2
813,2022-08-06 04:31:51+00:00,Pur_N4M4,@GratisTerbaik Bupati purwakarta terapkan PPKM menutup masjid s/d tgl 15 beh,bupati purwakarta terap ppkm tutup masjid s tanggal beh,1
7436,2022-08-19 11:56:56+00:00,sekdemang43,"RT @PolresProboKota: @HumasPoldaJatim Sebagai upaya #BangkitPulihIndonesia percepatan vaksinasi Covid-19, jajaran Korps Bhayangkara menjadi…",upaya bangkitpulihindonesia cepat vaksinasi covid jajar korps bhayangkara jadi,1
3347,2022-08-13 03:13:35+00:00,nanangfais_,@hashiromui Angkatan PPKM &amp; PSBB ga usah sok galak anjg,angkat ppkm psbb sok galak anjing,0
6581,2022-08-03 00:00:00+00:00,DelilaVazila,Vaksinasi adalah kunci utama untuk melindungi diri sendiri dan orang-orang terdekat dari bahaya Covid-19 varian Omicron BA.4 dan BA.5. Ayoo segera vaksinasi sekarang #DukungTerusDOBdanOtsus #PapuaIndonesia #wB5d https://t.co/gIorIPkIJ5,vaksinasi kunci utama lindung orang orang dekat bahaya covid varian omicron ba ba ayoo vaksinasi dukungterusdobdanotsus papuaindonesia wbd,2
3483,2022-08-12 03:17:40+00:00,Meilandwi,"@virusketik Semangat tenaga medis!!

#EndemiCovid
#IndonesiaSehatIndonesiaHebat
#BeritaCovid
#PPKM",semangat tenaga medis endemicovid indonesiasehatindonesiahebat beritacovid ppkm,2
8651,2022-08-13 02:38:16+00:00,RajoViral,Jalani Vaksinasi Booster Untuk tekan Penularan Covid-19. NKRI Tumbuh Kuat https://t.co/PYSDScbRwv,jalan vaksinasi booster tekan tular covid nkri tumbuh kuat,1
6331,2022-08-04 01:57:26+00:00,DeliSerdang_Kab,"UPDATE SITUASI COVID-19 DAN VAKSINASI DI KABUPATEN DELI SERDANG
Rabu, 3 Agustus 2022.
Call Center Covid-19 Kabupaten Deli Serdang : 0812-3131-9919
#DeliSerdangCegahCovid 
#TetapTerapkan5M
#AyoVaksin https://t.co/XwnAglw2Oc",update situasi covid vaksinasi kabupaten deli serdang rabu agustus call center covid kabupaten deli serdang deliserdangcegahcovid tetapterapkanm ayovaksin,1
2917,2022-08-15 15:40:37+00:00,mrahmatono,@Tan_Mar3M Awasss.. ni jgn2 ujug2 ada boommmmm tahu2 PPKM 4 LAGI,awasss ni ujug boommmmm ppkm,1
9569,2022-08-27 16:53:46+00:00,AlbertSolo2,RT @AlbertSolo2: Jepang di kabarkan akan segera melakukan vaksinasi booster dosis keempat bagi jutaan warganya dan warga asing yang tinggal…,jepang kabar vaksinasi booster dosis empat juta warga warga asing tinggal,1
1159,2022-08-04 05:06:30+00:00,CNNIndonesia,Masih Efektifkah PPKM Diterapkan untuk Cegah Penularan Covid-19? #Analisis https://t.co/FMYEOooni1,efektif ppkm terap cegah tular covid analisis,1
1738,2022-08-02 04:05:49+00:00,republikaonline,Level 1 berdasarkan pertimbangan para pakar dengan melihat kondisi faktual. https://t.co/d0ITJEHUL4,level dasar timbang pakar kondisi faktual,1
6866,2022-08-01 13:49:27+00:00,threes_v,"@Tribrataresbjr_ Apanya yg ga benar ? Klo soal gugatan ini sdh tau blm ? Masih berjalan lho
https://t.co/sl91yJAG74
Ini salah 1 kesaksian Prof.Norman Fenton di PTUN 
https://t.co/coN6Smeu7e
Atau gmn dgn hasil putusan MA tempo lalu terkait vaksin halal ?
Hayoo..jelaskan donk",apa gugat belum jalan lho salah saksi prof norman fenton ptun gmn hasil putus ma tempo kait vaksin halal hayoo donk,1
945,2022-08-05 07:58:49+00:00,AryoDek0,"RT @KikiDWibowo: #IndonesiaSehatIndonesiaHebat
Studi dari Cov-Boost yang menunjukan bahwa penyuntikan dosis keempat atau booster kedua vaks…",indonesiasehatindonesiahebat studi cov boost tunjuk sunti dosis empat booster vaks,1
4660,2022-08-23 16:41:26+00:00,kodikkodik,"RT @piotrj: @DJRachbini Bukan cuma membatasi kendaran adalah solusi. 

Di waktu PPKM, polusi udara malah tidak menurun pas kendaran tidak a…",batas kendaran solusi ppkm polusi udara turun pas kendaran a,1
4471,2022-08-25 02:12:53+00:00,forbdmonly,@Chanyeolnothin @INABadminton salfok spasi nya buset lg ppkm lu? 😀,salfok spasi buset lg ppkm kamu ,1
869,2022-08-05 16:33:13+00:00,maximvsatriaus,"RT @alvinrio_1501: 2020 psbb dengan tingkat angka dicovidkan
2021 psbb - ppkm indikator naik turun kampanye zero copit (3t&amp;5M)sikopat
2022…",psbb tingkat angka dicovidkan psbb ppkm indikator turun kampanye zero copit m sikopat ,1
9302,2022-08-29 08:44:50+00:00,beritacovid,"#Permudah Calon Penumpang, Besok Bandara Pattimura Ambon Buka Sentra Vaksinasi Covid-19 - Tribun Ambon #Covid #Covid19 https://t.co/c1DABEJCgp",mudah calon tumpang besok bandara pattimura ambon buka sentra vaksinasi covid tribun ambon covid covid,1
8111,2022-08-16 07:33:26+00:00,sing_ayudewe,"Indonesia 5 besar vaksinasi Covid-19 terbanyak di dunia

@jokowi #indonesiamaju https://t.co/tAGdQgHES5",indonesia vaksinasi covid dunia indonesiamaju,1
2506,2022-08-18 06:49:36+00:00,_munteanu,"Pengendalian Covid-19 Indonesia terbaik se Asia #EndemiCovid
#IndonesiaSehatIndonesiaHebat
#BeritaCovid
#PPKM https://t.co/kuQRA7BuSV",kendali covid indonesia baik asia endemicovid indonesiasehatindonesiahebat beritacovid ppkm,1
3996,2022-08-28 17:27:51+00:00,KodimKarangany1,KARANGANYAR - Senin 29 Agustus 2022 Serma Ahmad anggota Babinsa Koramil 02/Tasikmadu melaksanakan patroli PPKM Level 3 di Pasar Nglanu Tasikmadu menghimbau pedagang/pengujung di Pasar Nglanu untuk mematuhi dan mentaati protokol kesehatan guna mencegah penularan Covid 19 dengan 5M https://t.co/clSeVvbQvV,karanganyar senin agustus serma ahmad anggota babinsa koramil tasikmadu laksana patroli ppkm level pasar nglanu tasikmadu menghimbau dagang ujung pasar nglanu patuh taat protokol sehat cegah tular covid m,1
1781,2022-08-02 02:32:41+00:00,yellibraries,capek banget ppkm,capek banget ppkm,0
6144,2022-08-05 01:01:01+00:00,rctvcirebon,"Pemerintah Kabupaten Brebes, berencana melakukan vaksinasi dosis keempat atau vaksin booster jilid 2. Alasannya, angka kasus covid-19... - https://t.co/6IoB6SQX2I https://t.co/Rj70gXtaqA",perintah kabupaten brebes rencana vaksinasi dosis empat vaksin booster jilid alas angka covid,1
1769,2022-08-02 02:58:10+00:00,koramilkarangm2,"Pada hari Selasa tgl   02  Agustus  2022  pukul 08.00  wib  s/d selesai telah dilaksanakan giat  patroli dalam rangka  Pelaksanaan PPKM LEVEL I membatasi Mobilitas Perpindahan Masyarakat, bertempat di wilayah kecamatan Karangmalang. https://t.co/Oiq8vrOxz8",selasa tanggal agustus wib s selesai laksana giat patroli rangka laksana ppkm level i batas mobilitas pindah masyarakat tempat wilayah camat karangmalang,1
7302,2022-08-20 03:23:32+00:00,setiadi8770,"Vaksinasi Booster efektif meningkatkan kekebalan tubuh agar tidak mudah terpapar covid-19.
Ekonomi NKRI Bertumbuh https://t.co/NU59tYc68c",vaksinasi booster efektif tingkat kebal tubuh mudah papar covid ekonomi nkri tumbuh,2
6521,2022-08-03 02:21:05+00:00,saeni_sukri,"Kegiatan Vaksinasi COVID 19  bagi masyarakat kota palu dan sekitarnya di selenggarakan Oleh Dinas Kesehatan Propinsi Sulteng bersama Polsek Palu Timur Polresta Palu,di Pimpin  Langsung BPK Kapolsek Palu Timur AKP Stefanus Sanam bersama Wakapolsek Iptu Made Antara. https://t.co/VUEthfG4gQ",giat vaksinasi covid masyarakat kota palu selenggara dinas sehat propinsi sulteng polsek palu timur polresta palu pimpin langsung bpk kapolsek palu timur akp stefanus sanam wakapolsek iptu made,1
8901,2022-08-12 02:23:55+00:00,BernamaTV,"#ICYMI #BuletinBernama : Kerajaan akan merujuk kepada pakar-pakar sebelum memutuskan mengenai keperluan melaksanakan vaksinasi COVID-19 secara tahunan.
https://t.co/EVELWni4TV",icymi buletinbernama raja rujuk pakar pakar putus perlu laksana vaksinasi covid tahun,1
9186,2022-08-30 03:59:11+00:00,LuisChaniago,"Vaksinasi lengkap berikan kekebalan tambahan atasi covid-19
IKN Pasti Mantap https://t.co/ZsU0d9rozB",vaksinasi lengkap kebal tambah atas covid ikn mantap,2
10811,2022-08-22 02:37:47+00:00,kenzoramadhann,"Polri semuanya siap menolong program vaksinasi Covid-19 manfaat mewujudkan masyarakat yang sehat, ekonomi kuat dan semakin produktif

#WujudkanPemulihanEkonomi

Kawal Investasi Nasional",polri tolong program vaksinasi covid manfaat wujud masyarakat sehat ekonomi kuat produktif wujudkanpemulihanekonomi kawal investasi nasional,1
7868,2022-08-17 10:53:18+00:00,Beritasatu,"Vaksinasi Covid-19 Dosis Booster Telah Capai 25,10% Target https://t.co/g75Y3OE3HM",vaksinasi covid dosis booster capai target,1
1966,2022-08-01 11:38:38+00:00,spotdrug,@fairytalm Planga Plongo Kayak Monyet = PPKM,planga plongo kayak monyet ppkm,0
8294,2022-08-16 00:00:01+00:00,ares_qx,Mari ikut Vaksinasi karena dapat meningkatkan daya tahan tubuh dari virus Corona supaya terhindar dari Covid-19 varian baru Omicron BA.4 dan BA.5 #DOBMembawaDampakPositif #PapuaIndonesia https://t.co/pmeyCfeNC0,mari vaksinasi tingkat daya tahan tubuh virus corona hindar covid varian omicron ba ba dobmembawadampakpositif papuaindonesia,2
6522,2022-08-03 02:17:31+00:00,Ristyan25825085,Mari kita laksanakan vaksinasi dan tetap patuhi prokes untuk menghindari varian baru covid-19. Infrastruktur Jokowi Hebat https://t.co/bldhLlnyLy,mari laksana vaksinasi patuh prokes hindar varian covid infrastruktur jokowi hebat,2
5938,2022-08-06 00:00:00+00:00,IstinanR,"Jangan lupa untuk tetap menerapkan protokol kesehatan demi memutuskan penyebaran virus Covid-19 varian Omicron BA.4 dan BA.5, meskipun sudah mendapatkan vaksinasi booster. 

#DOBMomentumPenting #PapuaIndonesia https://t.co/Ygo6uD90b6",lupa terap protokol sehat putus sebar virus covid varian omicron ba ba vaksinasi booster dobmomentumpenting papuaindonesia,2
5700,2022-08-07 14:28:36+00:00,katasulsel,"Tren Capaian Vaksinasi Covid-19 di Sidrap Meningkat, Kapolres Erwin Syah: Mari Tetap Konsisten dan Tingkatkan https://t.co/PXAlCQT5ZF",tren capai vaksinasi covid sidrap tingkat kapolres erwin syah mari konsisten tingkat,1
10293,2022-08-23 12:01:19+00:00,lampungpost_,"Polres Lampung Barat mulai melaksanakan pelayanan vaksinasi booster tahap kedua yang diselenggarakan oleh Tim Kesehatan Poliklinik Polres setempat.
#polreslambar #Vaksin #vaksinbooster #boosterdosiskedua #infovaksin #lampungpost
https://t.co/wOlPRqn8Ae",polres lampung barat laksana layan vaksinasi booster tahap selenggara tim sehat poliklinik polres polreslambar vaksin vaksinbooster boosterdosiskedua infovaksin lampungpost,1
3159,2022-08-14 06:32:46+00:00,urtsukii,"MALES BANGETTTT TAU GAAA,
aku mau cerita, jadi akhir akhir ini aku kepikiran ospek jurusan kan, kok ga dibentuk bentuk panitianya, aku ngerasa gitu aja, padahal akhir bulan udh ppkmb jurusan nih
tau tau di grup hima bilang, besok jangan lupa rapat pemaparan konsep ppkm jurusan!!!",males bangetttt gaaa cerita pikir ospek jurus bentuk bentuk panitia ngerasa gitu udah ppkmb jurus grup hima besok lupa rapat papar konsep ppkm jurus,1
4184,2022-08-27 05:29:43+00:00,cakra9901,"KARANGANYAR - Sertu Darmato beserta 2 anggota Koramil 02/Tasikmadu melaksanakan patroli PPKM level 3 bertempat di pasar daging Papahan, Tasikmadu dengan menghimbau pada pedagang dan pengunjung agar mentaati protokol kesehatan guna mencegah penularan Covid 19 dengan cara 5M https://t.co/K2UhIYTmq7",karanganyar sertu darmato serta anggota koramil tasikmadu laksana patroli ppkm level tempat pasar daging papah tasikmadu menghimbau dagang unjung taat protokol sehat cegah tular covid m,1
5189,2022-08-10 02:18:37+00:00,PolsekPupuan,"Vaksinasi melindungi diri dari Covid-19, segera vaksinasi Booster #ayokitavaksin #ayovaksìncovid19 #vaksìnbooster #vaksìncovid19 #vaksinasicovid19 #vaksinaman #bersatulawancovid19 #bersamalawancorona #polrestabanan https://t.co/W4rFQMZfEX",vaksinasi lindung covid vaksinasi booster ayokitavaksin ayovaks ncovid vaks nbooster vaks ncovid vaksinasicovid vaksinaman bersatulawancovid bersamalawancorona polrestabanan,2
9649,2022-08-27 01:49:37+00:00,GarudaCares,"@NFEffendi Mohon maaf sebelumnya, kami koreksi informasi terkait persyaratan penerbangan pada penerbangan tersebut. Apabila penumpang telah menerima vaksinasi dosis ketiga, maka tidak perlu menunjukan hasil tes negatif Covid-19. (1/2) - Lea",mohon maaf koreksi informasi kait syarat terbang terbang tumpang terima vaksinasi dosis tiga tunjuk hasil tes negatif covid lea,1
2218,2022-08-20 02:58:08+00:00,younghonx,Weekend ini ppkm lagi. https://t.co/tWwnfpItDn,weekend ppkm,1
8890,2022-08-12 02:48:04+00:00,Meylindarichez,"Pemerintah terus menggenjot pencapaian vaksinasi Covid-19 Booster untuk memperkuat Herd Immunity

IKN Meratakan Pembangunan https://t.co/oIoqwCFpH8",perintah genjot capai vaksinasi covid booster kuat herd immunity ikn rata bangun,1
2512,2022-08-18 06:22:57+00:00,juyoien,"@YUNH5O Kalau saya paling suka lomba PPKM seperti ini, saya paling ahlinya. Bagaimana lomba yang kamu ikuti itu? Apakah kamu memenangkan lombanya? https://t.co/EedBLmKbo6",suka lomba ppkm ahli lomba ikut menang lomba,1
4685,2022-08-23 14:00:22+00:00,RamilGemolong,"Pada hari Selasa tgl 23 Agustus 2022 Pkl 20.30.Wib s.d selesai telah dilaksanakan Giat  patroli gabungan bersama Polsek Gemolong dalam rangka pelaksanaan *PPKM LEVEL I* membatasi Mobilitas Perpindahan Masyarakat,  di wilayah Kec. Gemolong. https://t.co/IXhF9TaSXl",selasa tanggal agustus pkl wib s selesai laksana giat patroli gabung polsek golong rangka laksana ppkm level i batas mobilitas pindah masyarakat wilayah kec golong,1
5882,2022-08-06 03:17:14+00:00,arminpujasera,RT @Ristyan25825085: Mari laksanakan vaksinasi dan disiplin jaga prokes agar pandemi covid-19 segera berakhir. Program Jokowi Terdepan http…,mari laksana vaksinasi disiplin jaga prokes pandemi covid program jokowi depan http,2
